{
  "_comment": "Per-build hook-point map (design doc §5.3), here for the minimm prototype build. In production TMOS this is emitted by the build pipeline, signed, and shipped alongside the image; a shield resolves its target hook by NAME against this map, and arg_btf carries the typed argument layout the verifier checks a program against. NOTE: field_offsets and ctx_size are authoritative — they must come from the build's debug info, never from re-packing the field list. `make -C substrate check-offsets` asserts them against ls_shield.h; an earlier revision of this file omitted the `mode` field, which silently moved the computed offset of `head` from 12 to 8.",
  "tmos_version": "minimm-0.1",
  "build_id": "prototype",
  "ctx_abi_version": 1,
  "generated_by": "hand-written (prototype); hookmap_gen.py in product",
  "hook_points": [
    {
      "name": "ls_request_eval_decision",
      "symbol": "ls_request_eval_decision",
      "attach_mode": "filter",
      "path_class": "cold",
      "enumerated_outcomes": ["LS_PASS", "LS_DROP", "LS_RESET"],
      "arg_btf": {
        "arg0": {
          "type": "const struct ls_ctx *",
          "ctx_size": 28,
          "fields": {
            "opcode":      "u16",
            "payload_len": "u16",
            "avail_len":   "u32",
            "mode":        "u32",
            "head":        "u8[16]"
          },
          "field_offsets": {
            "opcode":      0,
            "payload_len": 2,
            "avail_len":   4,
            "mode":        8,
            "head":        12
          }
        }
      },
      "abort_branch": "host returns LS_DROP/LS_RESET before process_frame() dispatch; no state to unwind (design §6.1)"
    }
  ]
}
